focus_area,form,repo,coverage_scope,parity_status,irs_source_url,scenario_refs,evidence_files,summary,remaining_gap,last_audited
business_qbi,Form 8995,UsTaxes,"Simplified QBI deduction for Schedule C and K-1 inputs",patched_partial,https://www.irs.gov/instructions/i8995,"direct-file scenario-28-taylor-qbi.json | UsTaxes scenario14.test.ts","/Users/tkhan/IdeaProjects/taxes/UsTaxes/src/forms/Y2025/irsForms/F8995.ts | /Users/tkhan/IdeaProjects/taxes/UsTaxes/src/forms/Y2025/irsForms/Schedule1.ts | /Users/tkhan/IdeaProjects/taxes/UsTaxes/src/forms/Y2025/irsForms/ScheduleSE.ts | /Users/tkhan/IdeaProjects/taxes/UsTaxes/src/forms/Y2025/irsForms/F1040.ts | /Users/tkhan/IdeaProjects/taxes/UsTaxes/src/forms/Y2025/tests/obbba2025Law.test.ts","Now includes Schedule C net profit in the business-income, Schedule SE, QBI trigger, and Form 8995 simplified computation path, and it sources wage/UBIA inputs from Schedule C business metadata and K-1 section 199A metadata instead of hardcoding zeros.","Still lacks REIT/PTP components, prior-year QBI loss carryovers, rental QBI qualification logic, SSTB-specific handling, and full IRS attachment behavior for overflow businesses.",2026-03-13
business_qbi,Form 8995-A,UsTaxes,"Detailed QBI computation with wage/property limitation",patched_partial,https://www.irs.gov/instructions/i8995a,"direct-file scenario-28-taylor-qbi.json | obbba2025Law.test.ts","/Users/tkhan/IdeaProjects/taxes/UsTaxes/src/forms/Y2025/irsForms/F8995A.ts | /Users/tkhan/IdeaProjects/taxes/UsTaxes/src/forms/Y2025/tests/obbba2025Law.test.ts","Now keeps per-business wage and UBIA limitation math separated across lines A/B/C, uses real wage/UBIA sourcing, and aggregates detailed QBI deductions across more than three business entries for calculation parity even when the PDF only exposes three slots.","Still lacks patron reductions, REIT/PTP, DPAD, SSTB/aggregation elections, and true attachment generation for businesses beyond the paper-form slots.",2026-03-13
business_qbi,QBI aggregate engine,Direct File,"Thresholds, SSTB phaseout, wage/property limitation, REIT/PTP component",partial,"https://www.irs.gov/instructions/i8995 | https://www.irs.gov/instructions/i8995a","scenario-28-taylor-qbi.json","/Users/tkhan/IdeaProjects/taxes/direct-file-easy-webui/direct-file/backend/src/main/resources/tax/qbiDeduction.xml | /Users/tkhan/IdeaProjects/taxes/direct-file-easy-webui/direct-file/backend/src/main/resources/tax/form8995.xml | /Users/tkhan/IdeaProjects/taxes/direct-file-easy-webui/direct-file/backend/src/main/resources/tax/form8995A.xml","Stronger than UsTaxes on thresholding, SSTB applicable percentage, wage/property limitation, and REIT/PTP handling in the central QBI engine.","Form 8995-A resource is still effectively single-business oriented and does not model the full IRS attachment/aggregation surface.",2026-03-13
rental,Schedule E,UsTaxes,"Part I rental property income/expense matrix plus K-1 page 2 columns",patched_partial,https://www.irs.gov/instructions/i1040se,"UsTaxes scenario18.test.ts | UsTaxes scenarioNR2.test.ts | UsTaxes scenario3.test.ts","/Users/tkhan/IdeaProjects/taxes/UsTaxes/src/forms/Y2025/irsForms/ScheduleE.ts | /Users/tkhan/IdeaProjects/taxes/UsTaxes/src/forms/Y2025/irsForms/F8582.ts | /Users/tkhan/IdeaProjects/taxes/UsTaxes/src/forms/Y2025/tests/ScheduleEParity.test.ts","Now implements rental receipts, major expense rows, vacation-home use test, 1099-MISC royalty income, optional royalty expenses, page 2 estate/trust REMIC and farm-rental branches, and passive loss limitation through Form 8582 without recursing on royalty-only returns.","Modified AGI in F8582 is still simplified, richer K-1 page 2 rental/royalty breakdowns remain under-modeled, and PDF support is still capped to 3 properties and 4 K-1s.",2026-03-13
rental,Schedule E,Direct File,"Single-property rental/royalty facts with passive-loss allowance derivation",partial,https://www.irs.gov/instructions/i1040se,"scenario-18-thompson-rental.json | scenario-nr2-desilva.json","/Users/tkhan/IdeaProjects/taxes/direct-file-easy-webui/direct-file/backend/src/main/resources/tax/scheduleE.xml","Stronger than UsTaxes on derived passive-loss allowance mechanics and explicit rental fact graph calculations.","Resource is mostly single-property oriented and does not expose the full Schedule E page 2 K-1 matrix or multi-property column behavior expected on the paper form.",2026-03-13
nonresident,Form 1040-NR,UsTaxes,"Nonresident wrapper for ECI, FDAP, treaty, deductions, and payment inputs",patched_partial,https://www.irs.gov/instructions/i1040nr,"UsTaxes scenarioNR1.test.ts | UsTaxes scenarioNR2.test.ts | UsTaxes scenarioNR3.test.ts | UsTaxes scenarioNR4.test.ts | UsTaxes scenarioNR12.test.ts | f1040nrParity.test.ts","/Users/tkhan/IdeaProjects/taxes/UsTaxes/src/forms/Y2025/irsForms/F1040NR.ts | /Users/tkhan/IdeaProjects/taxes/UsTaxes/src/forms/Y2025/tests/f1040nrParity.test.ts","Now computes taxable ECI, tax on ECI using the 2025 ordinary tax table, total tax, and refund/balance-due outputs instead of only exposing raw inputs.","Still far from full line-by-line 1040-NR parity: no explicit Schedule OI item mapping, no schedule NEC detail table, treaty modeling is simplified, and ATS scenario output coupling is still loose.",2026-03-13
nonresident,Form 1040-NR,Direct File,"Fact graph for nonresident flag, ECI, FDAP, treaty, deductions, and total tax",patched_partial,https://www.irs.gov/instructions/i1040nr,"scenario-nr1-leblanc.json | scenario-nr2-desilva.json | scenario-nr3-alfaro.json | scenario-nr4-hill.json | scenario-nr12-harrier.json","/Users/tkhan/IdeaProjects/taxes/direct-file-easy-webui/direct-file/backend/src/main/resources/tax/form1040NR.xml | /Users/tkhan/IdeaProjects/taxes/direct-file-easy-webui/direct-file/backend/src/test/java/gov/irs/directfile/api/ats/converter/ATSToFactGraphConverter.java | /Users/tkhan/IdeaProjects/taxes/direct-file-easy-webui/direct-file/backend/src/test/java/gov/irs/directfile/api/ats/TaxYear2025RegressionTest.java","Now derives taxOnECI from the published 2025 bracket schedule instead of leaving it writable, and the ATS converter now emits explicit filing-status booleans plus core nonresident facts for country, ECI, FDAP, and itemized deduction backfills.","Still simplified versus the actual 1040-NR package: Schedule OI/NEC specifics are under-modeled, treaty detail remains shallow, and several ATS scenario branches still depend on fixture backfills more than fully explicit form facts.",2026-03-13
crosscutting,Local parity harness,Cloudflare + TaxFlow,"Worker-backed local auth, CRUD, review, submission, rejection, state-transfer, print-mail",aligned,n/a,"worker runtime e2e | local TaxFlow e2e","/Users/tkhan/IdeaProjects/taxes/UsTaxes/backend-cloudflare/scripts/run-taxflow-local-e2e.sh | /Users/tkhan/IdeaProjects/taxes/UsTaxes/backend-cloudflare/scripts/run-taxflow-local-e2e.mjs | /Users/tkhan/IdeaProjects/taxes/taxflow/server/index.ts","Local end-to-end worker-backed flow is now green and can be used to validate future form-parity fixes through the TaxFlow surface.","Harness validates lifecycle orchestration, but deeper form-output parity still depends on the underlying tax-engine form implementations listed above.",2026-03-13
